slug,parent,title,filepath,status,post_type,target,goal,seo_title,seo_keywords,seo_description,handson_overview
future-trends,level6-future,今後の展望,contents/level6-future/future-trends.md,not_started,pages,先進ユーザー,"今後の方向性を踏まえ学習/投資計画に反映する。","生成AIの未来予測","ロードマップ, 研究, ビジネス インパクト","短中期の注目トピックを整理。",不要
appendix,,付録,contents/appendix/appendix.md,not_started,pages,全ユーザー,"参照性の高い資料を集約し学習・運用を支援する。","付録 | 用語集・FAQ・リンク","用語集, FAQ, 参考リンク, コスト","辞書/FAQ/試算シート/リンクのリソース集。",不要
glossary,appendix,用語集,contents/appendix/glossary.md,not_started,pages,全ユーザー,"専門用語の意味を素早く確認できるようにする。","OpenAI用語集","用語集, 定義, 初心者","最低限知っておきたい用語を簡潔に解説。",不要
faq,appendix,よくある質問（FAQ）,contents/appendix/faq.md,not_started,pages,全ユーザー,"共通の疑問を事前に解消し学習を円滑にする。","OpenAI FAQ","よくある質問, トラブル, 料金","つまずきやすい質問に一問一答で回答。",不要
cost-sheet,appendix,コスト試算シート,contents/appendix/cost-sheet.md,not_started,pages,開発者,"モデル別の概算費用を把握し予算計画に活かす。","APIコストの見積もり方","料金 試算, トークン, 目安","ユースケース別の概算表と削減Tipsを掲載。","使用量入力→概算料金算出の手順"
links,appendix,リンク集,contents/appendix/links.md,not_started,pages,全ユーザー,"信頼できる外部リソースへ素早くアクセスできるようにする。","OpenAI公式＆学習リンク集","公式 ドキュメント, GitHub, 学習 資料","必読の一次情報と良質な学習サイトを厳選掲載。",不要
